{"battery":{"id":"justesse","revision":1,"sha256":"8c4dc5b71c668c7d272cb1cc5003d1dc1692a0a08565e79c9c75d8f354eebbdc","source_sha256":"9a6c7e2cf620e6ad44c5c1c7f76c0c459bdd47f93545d1b5eb902c423372b10f"},"campaign_id":"9177fc4da44232f91e71eccf3e4e84e0","categories":[{"category":"memoire","deltas":{"access":1.0,"orchestration":0.0,"substrate":1.0},"items":3,"judge_pending":0,"noncomplete":0,"rates":{"core_origin":1.0,"gemma_info":1.0,"gemma_nu":0.0},"scored_items":3,"successes":{"core_origin":3,"gemma_info":3,"gemma_nu":0}},{"category":"rag","deltas":{"access":1.0,"orchestration":0.0,"substrate":1.0},"items":2,"judge_pending":1,"noncomplete":0,"rates":{"core_origin":1.0,"gemma_info":1.0,"gemma_nu":0.0},"scored_items":1,"successes":{"core_origin":1,"gemma_info":1,"gemma_nu":0}},{"category":"outils","deltas":{"access":0.6666666666666666,"orchestration":0.33333333333333337,"substrate":1.0},"items":3,"judge_pending":0,"noncomplete":0,"rates":{"core_origin":1.0,"gemma_info":0.6666666666666666,"gemma_nu":0.0},"scored_items":3,"successes":{"core_origin":3,"gemma_info":2,"gemma_nu":0}},{"category":"temps","deltas":{"access":1.0,"orchestration":0.0,"substrate":1.0},"items":2,"judge_pending":0,"noncomplete":0,"rates":{"core_origin":1.0,"gemma_info":1.0,"gemma_nu":0.0},"scored_items":2,"successes":{"core_origin":2,"gemma_info":2,"gemma_nu":0}},{"category":"temoin","deltas":{"access":0.0,"orchestration":0.0,"substrate":0.0},"items":7,"judge_pending":1,"noncomplete":0,"rates":{"core_origin":1.0,"gemma_info":1.0,"gemma_nu":1.0},"scored_items":6,"successes":{"core_origin":6,"gemma_info":6,"gemma_nu":6}}],"fairness":{"core_information_replayed_exactly":true,"gemma_info_tools_disabled":true,"gemma_nu_user_only":true,"same_live_binding":true,"same_sampling":true,"same_seed":true},"items":[{"category":"temoin","contrasts":{"access":"both","orchestration":"both","substrate_vs_bare":"both"},"core_origin":{"binding_sha256":"e9fe86e9e4bfe6647e9cfc83b489be6ceb168789673f818f9c3576c5633ed0fa","expected_tool_called":null,"grounded":null,"information_sha256":null,"passed":true,"reason_code":null,"response_sha256":"3923dd946c2f4075693925d259b50015bc64d4a52c62f55c7e73d433d4284a0b","response_text":"Il faut toujours **3 minutes**.\n\nVoici le raisonnement :\nSi 3 machines produisent 3 pièces en 3 minutes, cela signifie qu'**une seule machine met 3 minutes pour fabriquer une seule pièce**.\n\nPar conséquent, si vous avez 100 machines travaillant simultanément, chacune fabriquera sa propre pièce en 3 minutes, ce qui permet d'obtenir 100 pièces au total dans le même laps de temps.","sampling_sha256":"6815d5c5f3a65be2af89ab34f4ea72213b9f765bc4a11615516c84d3a2205990","scoring_rule":"expected-match","status":"completed","subject_id":"core-origin","tool_calls":[]},"evidence":{"case_result":{"identifier":"case-result","relative_path":"cases/ctrl-01/evidence/case-result.json","schema_id":"elyne.eval.justesse-case-result/v2","sha256":"ff1bf36dc9d8433b7172e93facc84166bdca0ddc7a63212e4228d9a61930f1a8","size_bytes":2309},"surfaced_information":{"identifier":"surfaced-information","relative_path":"cases/ctrl-01/evidence/surfaced-information.json","schema_id":"elyne.eval.justesse-surfaced-information/v1","sha256":"d69f738181394009f9a0d1fedf39d9d8d0e96958718fdb233877bc306e6ce86f","size_bytes":1098},"tool_call_trace":{"identifier":"tool-call-trace","relative_path":"cases/ctrl-01/evidence/tool-call-trace.json","schema_id":"elyne.eval.justesse-tool-call-trace/v2","sha256":"0359b0f11d9a4ece633567138eb5c084a3a494b93cc86c9eeca6bf584dec5530","size_bytes":232}},"gemma_info":{"binding_sha256":"e9fe86e9e4bfe6647e9cfc83b489be6ceb168789673f818f9c3576c5633ed0fa","expected_tool_called":null,"grounded":null,"information_sha256":"d69f738181394009f9a0d1fedf39d9d8d0e96958718fdb233877bc306e6ce86f","passed":true,"reason_code":null,"response_sha256":"38a56aad8a9d9d625463160f5300f4607e12bb6059784fea50c10465134c4d34","response_text":"La réponse est **3 minutes**.\n\n**Explication :**\nSi 3 machines mettent 3 minutes pour fabriquer 3 pièces, cela signifie qu'**une machine met 3 minutes pour fabriquer une pièce**.\n\nPar conséquent, si vous avez 100 machines travaillant simultanément, chacune fabriquera sa propre pièce en 3 minutes. Au bout de ces 3 minutes, les 100 machines auront produit leurs 100 pièces respectives.","sampling_sha256":"6815d5c5f3a65be2af89ab34f4ea72213b9f765bc4a11615516c84d3a2205990","scoring_rule":"expected-match","status":"completed","subject_id":"gemma-info","tool_calls":[]},"gemma_nu":{"binding_sha256":"e9fe86e9e4bfe6647e9cfc83b489be6ceb168789673f818f9c3576c5633ed0fa","expected_tool_called":null,"grounded":null,"information_sha256":null,"passed":true,"reason_code":null,"response_sha256":"a47fff2b73bb03545a41b2fce30b29dd435e9b828b27934283dea19f38704560","response_text":"Il faut **3 minutes**.\n\n**Explication :**\nSi 3 machines fabriquent 3 pièces en 3 minutes, cela signifie que chaque machine met **3 minutes pour fabriquer une pièce**.\n\nPar conséquent, si vous avez 100 machines travaillant simultanément, chacune fabriquera sa propre pièce en 3 minutes. Au bout de 3 minutes, les 100 machines auront produit leurs 100 pièces respectives.","sampling_sha256":"6815d5c5f3a65be2af89ab34f4ea72213b9f765bc4a11615516c84d3a2205990","scoring_rule":"expected-match","status":"completed","subject_id":"gemma-nu","tool_calls":[]},"id":"ctrl-01","scoring":"objective","setup_sha256":"ca3d163bab055381827226140568f3bef7eaac187cebd76878e0b63e9e442356","substrate_should_help":false},{"category":"temoin","contrasts":{"access":"judge-pending","orchestration":"judge-pending","substrate_vs_bare":"judge-pending"},"core_origin":{"binding_sha256":"e9fe86e9e4bfe6647e9cfc83b489be6ceb168789673f818f9c3576c5633ed0fa","expected_tool_called":null,"grounded":null,"information_sha256":null,"passed":null,"reason_code":null,"response_sha256":"8e6e3442b2a44abd9a37cb84d7cf0bd37b09ba66d5aec24e1ff5a2ea3758661c","response_text":"C'est une distinction fondamentale en statistiques et en logique. Pour faire simple : **la corrélation est une observation, tandis que la causalité est une explication.**\n\nVoici le détail pour bien les différencier :\n\n### 1. La Corrélation (Le \"Quoi\")\nLa corrélation signifie que deux choses **bougent ensemble**. Quand l'une change, l'autre a tendance à changer aussi (soit dans le même sens, soit en sens inverse).\n*   **C'est un constat :** \"Je remarque que quand il se passe A, il se passe souvent B.\"\n*   **Attention :** La corrélation ne dit rien sur *pourquoi* cela arrive.\n\n### 2. La Causalité (Le \"Pourquoi\")\nLa causalité signifie qu'une chose **produit** l'autre. Il existe un lien de cause à effet direct.\n*   **C'est une explication :** \"A se produit, et c'est précisément ce qui provoque B.\"\n\n---\n\n### L'exemple concret pour bien comprendre\n\nImaginons une étude statistique sur les ventes de **crème solaire** et les cas de **coups de soleil**.\n\n1.  **La Corrélation :** On remarque que les jours où la vente de crème solaire augmente, le nombre de coups de soleil augmente aussi de façon spectaculaire. Il y a une corrélation positive très forte entre les deux.\n2.  **L'erreur de causalité :** Si on s'arrêtait là, on pourrait conclure (à tort) que *porter de la crème solaire cause des coups de soleil*. C'est absurde !\n3.  **La réalité (La Cause commune) :** Il existe une troisième variable, le **Soleil**. \n    *   Le soleil fait augmenter les ventes de crème solaire.\n    *   Le soleil provoque les coups de soleil.\n\nIci, la crème solaire et les coups de soleil sont corrélés, mais l'un ne cause pas l'autre. Ils ont tous deux une cause commune.\n\n### Pourquoi est-ce important ?\nOn fait souvent cette erreur dans les médias ou au quotidien :\n*   **Exemple type :** \"Depuis que j'ai commencé à porter ces chaussettes rouges, mon équipe de foot a gagné 3 matchs.\"\n    *   *Corrélation :* Les deux événements arrivent en même temps.\n    *   *Causalité :* Il est extrêmement peu probable que la couleur des chaussettes soit la cause de la victoire (la cause réelle étant probablement l'entraînement ou la forme des joueurs).\n\n**En résumé :** \n> *\"Corrélation n'est pas causalité.\"* Juste parce que deux choses arrivent en même temps ne signifie pas que l'une est responsable de l'autre.","sampling_sha256":"6815d5c5f3a65be2af89ab34f4ea72213b9f765bc4a11615516c84d3a2205990","scoring_rule":"judge-pending","status":"completed","subject_id":"core-origin","tool_calls":[]},"evidence":{"case_result":{"identifier":"case-result","relative_path":"cases/ctrl-02/evidence/case-result.json","schema_id":"elyne.eval.justesse-case-result/v2","sha256":"56f6e7f45dd1ea291f8cc74236bb604553baad4a2c01100026bec6f6a428acef","size_bytes":7299},"surfaced_information":{"identifier":"surfaced-information","relative_path":"cases/ctrl-02/evidence/surfaced-information.json","schema_id":"elyne.eval.justesse-surfaced-information/v1","sha256":"a70101ee0b2f3633d608f87831c5c612b437389b75902367fa0e4e6588e05a1b","size_bytes":1077},"tool_call_trace":{"identifier":"tool-call-trace","relative_path":"cases/ctrl-02/evidence/tool-call-trace.json","schema_id":"elyne.eval.justesse-tool-call-trace/v2","sha256":"ee4293c1a1b0f074c5eb4da0a6dc46d6a7510d5db80ffc3224035106dc5f17e3","size_bytes":232}},"gemma_info":{"binding_sha256":"e9fe86e9e4bfe6647e9cfc83b489be6ceb168789673f818f9c3576c5633ed0fa","expected_tool_called":null,"grounded":null,"information_sha256":"a70101ee0b2f3633d608f87831c5c612b437389b75902367fa0e4e6588e05a1b","passed":null,"reason_code":null,"response_sha256":"e0b1cf658e11cb5f11cb4f3e7d79d42ca4ad0c7276ee4734678f38060394c65f","response_text":"Voici une explication simple pour bien distinguer ces deux notions souvent confondues :\n\n### 1. La Corrélation (Le \"Constat\")\nLa corrélation signifie que **deux choses évoluent en même temps**. Quand l'une change, l'autre a tendance à changer aussi. C'est une observation statistique : il y a un lien visuel ou mathématique entre deux données.\n\n*   **Mot-clé